"Repository","Repository Link","Report","Title","Paper reference","Venue","Type"
"osf::rsf4m","https://osf.io/rsf4m","https://doi.org/10.17605/osf.io/rsf4m","Building Change Detection of Airborne Laser Scanning and Dense Image Matching Point Clouds using Height and Class Information","https://doi.org/10.5194/agile-giss-2-10-2021","AGILEGIS","conference"
"osf::dx92a","https://osf.io/dx92a","https://doi.org/10.17605/osf.io/dx92a","Investigating drivers’ geospatial abilities in unfamiliar environments","https://doi.org/10.5194/agile-giss-2-3-2021","AGILEGIS","conference"
"osf::KF8SR","https://osf.io/KF8SR","https://doi.org/10.17605/osf.io/kf8sr","Understanding COVID-19 Effects on Mobility: A Community-Engaged Approach","https://doi.org/10.5194/agile-giss-3-14-2022","AGILEGIS","conference"
"osf::6S2GP","https://osf.io/6S2GP","https://doi.org/10.17605/osf.io/6s2gp","A method to produce metadata describing and assessing the quality of spatial landmark datasets in mountain area","https://doi.org/10.5194/agile-giss-3-17-2022","AGILEGIS","conference"
"osf::c7vx3","https://osf.io/c7vx3","https://doi.org/10.17605/osf.io/c7vx3","Urban Sound Mapping for Wayfinding - A theoretical Approach and an empirical Study","https://doi.org/10.5194/agile-giss-4-9-2023","AGILEGIS","conference"
"osf::27wzp","https://osf.io/27wzp","https://doi.org/10.17605/osf.io/27wzp","Advancing Forest Monitoring and Assessment Through Immersive Virtual Reality","https://doi.org/10.5194/agile-giss-4-15-2023","AGILEGIS","conference"
"osf::d2shf","https://osf.io/d2shf","https://doi.org/10.17605/OSF.IO/D2SHF","Semantic complexity of geographic questions - A comparison in terms of conceptual transformations of answers","https://doi.org/10.5194/agile-giss-4-10-2023","AGILEGIS","conference"
