"Repository","Repository Link","Report","Title","Paper reference","Venue","Type"
"osf::W7VPH","https://osf.io/W7VPH","https://doi.org/10.17605/osf.io/W7VPH","Exploratory Analysis and Feature Selection for the Prediction of Nitrogen Dioxide","https://doi.org/10.5194/agile-giss-3-6-2022","AGILEGIS","conference"
"osf::WNCSM","https://osf.io/WNCSM","https://doi.org/10.17605/osf.io/wncsm","Traffic Regulation Recognition using Crowd-Sensed GPS and Map Data: a Hybrid Approach","https://doi.org/10.5194/agile-giss-3-22-2022","AGILEGIS","conference"
"osf::eu8kw","https://osf.io/eu8kw","https://doi.org/10.17605/osf.io/eu8kw","Extreme heat alerts and impacts across Mozambique 2016 - 2022: gathering evidence from media articles","https://doi.org/10.5194/agile-giss-4-11-2023","AGILEGIS","conference"
"osf::w42ad","https://osf.io/w42ad","https://doi.org/10.17605/osf.io/W42AD","The Impact of Traffic Lights on Modal Split and Route Choice: A use-case in Vienna","https://doi.org/10.5194/agile-giss-5-4-2024","AGILEGIS","conference"
"osf::txgzv","https://osf.io/txgzv","https://doi.org/10.17605/osf.io/TXGZV","Road Network Mapping from Multispectral Satellite Imagery: Leveraging Deep Learning and Spectral Bands","https://doi.org/10.5194/agile-giss-5-6-2024","AGILEGIS","conference"
